{
 "diff_version": "1.0",
 "diff_id": "da8c7cb20d21358086e16acd9114785b",
 "project_id": "e73c023a2e8e90349bb4d853730e1bfc",
 "base": {
  "snapshot_id": "c3ff832377ee3e0bcdd66aa561bdfa33",
  "ir_hash": "2b05f03a9274122eb5ff1a8bf49def9b02c59923e996f3a2a9d59f2fcf6b142d",
  "label": "F7-DV1 2026-07-02"
 },
 "target": {
  "snapshot_id": "c3ff832377ee3e0bcdd66aa561bdfa33",
  "ir_hash": "2b05f03a9274122eb5ff1a8bf49def9b02c59923e996f3a2a9d59f2fcf6b142d",
  "label": "F7-DV1 2026-07-02"
 },
 "taxonomy_version": "1.0",
 "rule_version": "rules-1.0",
 "lexicon_version": "lex-1.0",
 "comparability": {
  "tol_parity": true,
  "tol_keys_known": true,
  "unit_parity": true,
  "result_parity": null,
  "scope_parity": true,
  "coordinate_ok": true,
  "partial_any": false,
  "G7": {
   "count": 0,
   "threshold": 0,
   "pass": true,
   "effect": "none",
   "detail": []
  },
  "base_blocked": false,
  "target_blocked": false
 },
 "correspondence": {
  "matched": [
   {
    "dn": "p:87ae2f56d589",
    "nid_base": "p:87ae2f56d589",
    "nid_target": "p:87ae2f56d589",
    "ckey": "ck:9454ed2282ce",
    "method": "exact_path",
    "score": 1.0,
    "status": "auto"
   },
   {
    "dn": "p:8051c8e0492d",
    "nid_base": "p:8051c8e0492d",
    "nid_target": "p:8051c8e0492d",
    "ckey": "ck:cac61ffcbaf1",
    "method": "exact_path",
    "score": 1.0,
    "status": "auto"
   }
  ],
  "unmatched_base": [],
  "unmatched_target": [],
  "pending_n": 0,
  "method_counts": {
   "ledger": 0,
   "pid_map": 0,
   "exact_path": 2,
   "fingerprint": 0,
   "name_norm": 0,
   "fuzzy": 0,
   "manual": 0
  }
 },
 "structural": {
  "node_changes": [],
  "edge_changes": [],
  "orphans_delta": {
   "base": [],
   "target": [],
   "became_orphan": [],
   "left_orphan": []
  },
  "hierarchy_moves": [],
  "dyna": {
   "contacts_added": [],
   "contacts_removed": [],
   "scope_changed": []
  }
 },
 "parametric": {
  "node_params": [],
  "edge_params": [],
  "materials": [],
  "dims_delta": [],
  "result_delta": [],
  "rollup_delta": []
 },
 "semantic": {
  "blocked_by": null,
  "events": []
 },
 "character_seed": [],
 "stats": {
  "nodes_added": 0,
  "nodes_removed": 0,
  "nodes_matched": 2,
  "edges_added": 0,
  "edges_removed": 0,
  "edges_kind_changed": 0,
  "params_changed": 0,
  "params_noise": 7,
  "params_excluded": 0,
  "events": 0,
  "events_by_change_kind": {},
  "events_by_confidence": {
   "high": 0,
   "medium": 0,
   "low": 0
  }
 },
 "summary_text": "[대상] self-diff c3ff8323\n[구조] 변경 0",
 "summary_status": "ok",
 "created_at": 1756700000
}
